<?xml version="1.0" encoding="UTF-8"?>

<!--
  * registry/scheduledTasks.xml
  *
  * Copyright (c) 2014-2021 Simon Fraser University
  * Copyright (c) 2003-2021 John Willinsky
  * Distributed under the GNU GPL v3. For full terms see the file docs/COPYING.
  *
  * Scheduled tasks registry file.
  *
  * This file lists all scheduled tasks to be executed by the system.
  *
  * Note that this functionality requires scheduled task support to be enabled.
  * The degree of granularity supported for the task frequency depends on the
  * frequency the scheduled task script itself is scheduled to run (as
  * configured in cron, for example).
  *
  * Example task:
  *
  * <task class="submission.scheduledTask.ReviewReminderTask">
  * 	<descr>Send reviewer reminder emails, once per hour.</descr>
  * 	<frequency minute="0"/>
  * </task>
  -->

<!DOCTYPE scheduled_tasks SYSTEM "../lib/pkp/dtd/scheduledTasks.dtd">

<scheduled_tasks>
	<task class="lib.pkp.classes.task.ReviewReminder">
		<descr>Send automated reminders to reviewers to complete their assignments.</descr>
		<frequency hour="0"/>
	</task>
	<task class="lib.pkp.classes.task.StatisticsReport">
		<descr>Send automated statistics reports to journal managers and editors.</descr>
		<frequency day="1"/>
	</task>
	<task class="classes.tasks.SubscriptionExpiryReminder">
		<descr>Send automated reminders about subscription expiry.</descr>
		<frequency day="1"/>
	</task>
</scheduled_tasks>
